{
  "$schema": "http://json-schema.org/draft-07/schema#",
  "$id": "https://stylometric-transfer/schema/config.tunables.schema.json",
  "title": "Stylometric-Transfer Tunables Schema",
  "description": "Optional tuning parameters for humanizer conflict thresholds",
  "type": "object",
  "properties": {
    "humanizer_conflicts": {
      "type": "object",
      "properties": {
        "em_dash_keep_rate": { "type": "number", "minimum": 0 },
        "hedge_keep_rate": { "type": "number", "minimum": 0 },
        "first_person_keep_rate": { "type": "number", "minimum": 0 },
        "contractions_avoid_threshold": { "type": "number", "minimum": 0 },
        "contractions_use_threshold": { "type": "number", "minimum": 0 },
        "heading_title_case_keep_rate": { "type": "number", "minimum": 0 },
        "boldface_keep_per_1000w": { "type": "number", "minimum": 0 },
        "inline_header_list_keep_rate": { "type": "number", "minimum": 0 }
      },
      "additionalProperties": false
    },
    "humanizer_mandatory": {
      "type": "object",
      "properties": {
        "avoid_em_dashes": { "type": "boolean" },
        "emoji_policy": { "type": "string", "enum": ["remove", "replace", "none"] },
        "normalize_double_quotes": { "type": "boolean" },
        "sanitize_heading_qualifiers": {
          "oneOf": [
            { "type": "boolean" },
            {
              "type": "object",
              "properties": {
                "enabled": { "type": "boolean" },
                "allowlist": { "type": "array", "items": { "type": "string" } }
              },
              "additionalProperties": false
            }
          ]
        },
        "force_local_spelling": { "type": "string", "enum": ["none", "canadian", "australian", "british", "us"] }
      },
      "additionalProperties": false
    },
    "humanizer_variance": {
      "type": "object",
      "properties": {
        "enabled": { "type": "boolean" },
        "seed": { "type": "integer" },
        "max_ops_per_1000w": { "type": "number", "minimum": 0 },
        "allowed_ops": { "type": "array", "items": { "type": "string" } }
      },
      "additionalProperties": false
    },
    "humanization_metrics": {
      "type": "object",
      "properties": {
        "weights": {
          "type": "object",
          "additionalProperties": { "type": "number", "minimum": 0 }
        }
      },
      "additionalProperties": false
    },
    "humanization_baseline": {
      "type": "object",
      "properties": {
        "enabled": { "type": "boolean" },
        "window_words": { "type": "integer", "minimum": 50 },
        "stride_words": { "type": "integer", "minimum": 25 },
        "min_window_words": { "type": "integer", "minimum": 50 },
        "max_windows": { "type": "integer", "minimum": 1 }
      },
      "additionalProperties": false
    },
    "humanization_controller": {
      "type": "object",
      "properties": {
        "enabled": { "type": "boolean" },
        "seed": { "type": "integer" },
        "quantiles": { "type": "array", "items": { "type": "number", "minimum": 0, "maximum": 1 } },
        "range_pct": { "type": "number", "minimum": 0 },
        "min_width": { "type": "number", "minimum": 0 },
        "max_width": { "type": "number", "minimum": 0 },
        "allowed_metrics": { "type": "array", "items": { "type": "string" } },
        "feedback_enabled": { "type": "boolean" },
        "feedback_tolerance": { "type": "number", "minimum": 0 },
        "max_feedback_retries": { "type": "integer", "minimum": 0 }
      },
      "additionalProperties": false
    },
    "lexical_signals": {
      "type": "object",
      "properties": {
        "rare_words_limit": { "type": "integer", "minimum": 1 }
      },
      "additionalProperties": false
    },
    "lexical_avoidance": {
      "type": "object",
      "properties": {
        "rare_words_limit": { "type": "integer", "minimum": 1 }
      },
      "additionalProperties": false
    },
    "controls_normalization": {
      "type": "object",
      "properties": {
        "rewrite_policy": {
          "type": "object",
          "properties": {
            "jaccard_threshold": { "type": "number", "minimum": 0, "maximum": 1 },
            "dedupe_on_subset": { "type": "boolean" },
            "prefer_more_specific": { "type": "boolean" },
            "compress_directives": { "type": "boolean" },
            "directive_verbs": { "type": "array", "items": { "type": "string" } },
            "stopwords": { "type": "array", "items": { "type": "string" } }
          },
          "additionalProperties": false
        },
        "priority_order": {
          "type": "object",
          "properties": {
            "token_pattern": { "type": "string" },
            "dedupe_case_insensitive": { "type": "boolean" },
            "exclude_tokens": { "type": "array", "items": { "type": "string" } }
          },
          "additionalProperties": false
        }
      },
      "additionalProperties": false
    },
    "fiction_detection": {
      "type": "object",
      "properties": {
        "quote_span_min": { "type": "integer", "minimum": 0 },
        "quoted_ratio_min": { "type": "number", "minimum": 0, "maximum": 1 },
        "quote_para_ratio_min": { "type": "number", "minimum": 0, "maximum": 1 },
        "quoted_ratio_force": { "type": "number", "minimum": 0, "maximum": 1 }
      },
      "additionalProperties": false
    },
    "chunking": {
      "type": "object",
      "properties": {
        "max_input_tokens": { "type": "integer", "minimum": 200 },
        "chunk_split_on": { "type": "string", "enum": ["word", "sentence", "paragraph"] },
        "chunk_summary": {
          "type": "object",
          "properties": {
            "enabled": { "type": "boolean" },
            "summary_words": { "type": "integer", "minimum": 5 }
          },
          "additionalProperties": false
        },
        "min_chunks_when_perturbing": { "type": "integer", "minimum": 1 },
        "recovery_split_max_depth": { "type": "integer", "minimum": 0 },
        "recovery_split_min_chars": { "type": "integer", "minimum": 0 },
        "variance_aware": {
          "type": "object",
          "properties": {
            "enabled": { "type": "boolean" },
            "sentence_stdev_ref": { "type": "number", "minimum": 0 },
            "paragraph_burst_ref": { "type": "number", "minimum": 0 },
            "min_factor": { "type": "number", "minimum": 0 },
            "max_factor": { "type": "number", "minimum": 0 }
          },
          "additionalProperties": false
        }
      },
      "additionalProperties": false
    },
    "style_retry": {
      "type": "object",
      "properties": {
        "enabled": { "type": "boolean" },
        "threshold": { "type": "number", "minimum": 0, "maximum": 1 },
        "max_retries": { "type": "integer", "minimum": 0 }
      },
      "additionalProperties": false
    },
    "section_restore": {
      "type": "object",
      "properties": {
        "enabled": { "type": "boolean" },
        "max_restore_sections": { "type": "integer", "minimum": 0 },
        "heading_similarity_threshold": { "type": "number", "minimum": 0, "maximum": 1 },
        "signature_similarity_threshold": { "type": "number", "minimum": 0, "maximum": 1 },
        "signature_min_overlap": { "type": "integer", "minimum": 0 }
      },
      "additionalProperties": false
    },
    "sanity_checks": {
      "type": "object",
      "properties": {
        "line_count_warn_pct": { "type": "number", "minimum": 0 },
        "word_count_warn_pct": { "type": "number", "minimum": 0 },
        "paragraph_count_warn_pct": { "type": "number", "minimum": 0 }
      },
      "additionalProperties": false
    }
  },
  "additionalProperties": false
}
