{
  "humanizer_conflicts": {
    "em_dash_keep_rate": 0.5,
    "hedge_keep_rate": 1.0,
    "first_person_keep_rate": 0.5,
    "contractions_avoid_threshold": 2.0,
    "contractions_use_threshold": 0.5,
    "heading_title_case_keep_rate": 0.6,
    "boldface_keep_per_1000w": 3.0,
    "inline_header_list_keep_rate": 0.2
  },
  "humanizer_mandatory": {
    "avoid_em_dashes": true,
    "emoji_policy": "replace"
  },
  "section_restore": {
    "enabled": true,
    "max_restore_sections": 20,
    "heading_similarity_threshold": 0.85,
    "signature_similarity_threshold": 0.6,
    "signature_min_overlap": 6
  },
  "sanity_checks": {
    "line_count_warn_pct": 10.0,
    "word_count_warn_pct": 10.0,
    "paragraph_count_warn_pct": 10.0
  }
}
